{
  "$schema": "http://json-schema.org/draft-07/schema#",
  "description": "Official Replicate API schema for qwen/qwen-image",
  "properties": {
    "seed": {
      "type": "integer",
      "title": "Seed",
      "x-order": 15,
      "nullable": true,
      "description": "Random seed. Set for reproducible generation"
    },
    "image": {
      "type": "string",
      "title": "Image",
      "format": "uri",
      "x-order": 7,
      "description": "Input image for img2img pipeline"
    },
    "prompt": {
      "type": "string",
      "title": "Prompt",
      "x-order": 0,
      "description": "Prompt for generated image"
    },
    "go_fast": {
      "type": "boolean",
      "title": "Go Fast",
      "default": true,
      "x-order": 12,
      "description": "Run faster predictions with additional optimizations."
    },
    "guidance": {
      "type": "number",
      "title": "Guidance",
      "default": 3,
      "maximum": 10,
      "minimum": 0,
      "x-order": 14,
      "description": "Guidance for generated image. Lower values can give more realistic images. Good values to try are 2, 2.5, 3 and 3.5"
    },
    "strength": {
      "type": "number",
      "title": "Strength",
      "default": 0.9,
      "maximum": 1,
      "minimum": 0,
      "x-order": 8,
      "description": "Strength for img2img pipeline"
    },
    "image_size": {
      "allOf": [
        {
          "$ref": "#/components/schemas/image_size"
        }
      ],
      "default": "optimize_for_quality",
      "x-order": 11,
      "description": "Image size for the generated image"
    },
    "lora_scale": {
      "type": "number",
      "title": "Lora Scale",
      "default": 1,
      "x-order": 4,
      "description": "Determines how strongly the main LoRA should be applied."
    },
    "aspect_ratio": {
      "allOf": [
        {
          "$ref": "#/components/schemas/aspect_ratio"
        }
      ],
      "default": "16:9",
      "x-order": 10,
      "description": "Aspect ratio for the generated image"
    },
    "lora_weights": {
      "type": "string",
      "title": "Lora Weights",
      "x-order": 2,
      "nullable": true,
      "description": "Load LoRA weights. Only works with text to image pipeline. Supports arbitrary .safetensors URLs, tar files, and zip files from the Internet (for example, 'https://huggingface.co/flymy-ai/qwen-image-lora/resolve/main/pytorch_lora_weights.safetensors', 'https://example.com/lora_weights.tar.gz', or 'https://example.com/lora_weights.zip')"
    },
    "output_format": {
      "allOf": [
        {
          "$ref": "#/components/schemas/output_format"
        }
      ],
      "default": "webp",
      "x-order": 16,
      "description": "Format of the output images"
    },
    "enhance_prompt": {
      "type": "boolean",
      "title": "Enhance Prompt",
      "default": false,
      "x-order": 1,
      "description": "Enhance the prompt with positive magic."
    },
    "output_quality": {
      "type": "integer",
      "title": "Output Quality",
      "default": 80,
      "maximum": 100,
      "minimum": 0,
      "x-order": 17,
      "description": "Quality when saving the output images, from 0 to 100. 100 is best quality, 0 is lowest quality. Not relevant for .png outputs"
    },
    "negative_prompt": {
      "type": "string",
      "title": "Negative Prompt",
      "default": " ",
      "x-order": 9,
      "description": "Negative prompt for generated image"
    },
    "extra_lora_scale": {
      "type": "array",
      "items": {
        "type": "number"
      },
      "title": "Extra Lora Scale",
      "x-order": 6,
      "nullable": true,
      "description": "Scales for additional LoRAs as an array of numbers (e.g., 0.5, 0.7). Must match the number of weights in extra_lora_weights."
    },
    "replicate_weights": {
      "type": "string",
      "title": "Replicate Weights",
      "x-order": 3,
      "nullable": true,
      "description": "Load LoRA weights from Replicate training. Only works with text to image pipeline. Supports arbitrary .safetensors URLs, tar files, and zip files from the Internet."
    },
    "extra_lora_weights": {
      "type": "array",
      "items": {
        "type": "string"
      },
      "title": "Extra Lora Weights",
      "x-order": 5,
      "nullable": true,
      "description": "Additional LoRA weights as an array of URLs. Same formats supported as lora_weights (e.g., ['https://huggingface.co/flymy-ai/qwen-image-lora/resolve/main/pytorch_lora_weights.safetensors', 'https://huggingface.co/flymy-ai/qwen-image-realism-lora/resolve/main/flymy_realism.safetensors'])"
    },
    "num_inference_steps": {
      "type": "integer",
      "title": "Num Inference Steps",
      "default": 30,
      "maximum": 50,
      "minimum": 1,
      "x-order": 13,
      "description": "Number of denoising steps. Recommended range is 28-50, and lower number of steps produce lower quality outputs, faster."
    },
    "disable_safety_checker": {
      "type": "boolean",
      "title": "Disable Safety Checker",
      "default": false,
      "x-order": 18,
      "description": "Disable safety checker for generated images."
    }
  },
  "required": ["prompt"],
  "title": "qwen-image Input Schema",
  "type": "object"
}
