{
  "aspect_ratio": "1:1",
  "disable_safety_checker": false,
  "enhance_prompt": false,
  "go_fast": true,
  "guidance": 3,
  "image": "asset_product_123",
  "negative_prompt": "busy backgrounds",
  "num_inference_steps": 30,
  "output_format": "jpg",
  "output_quality": 80,
  "prompt": "Create a launch image for the new bottle. Reusable bottle. sun-drenched ceramics studio. Centered product portrait. soft window light. Clean editorial product photography. Visible text: NEW. Keep the bottle label readable",
  "seed": 42,
  "strength": 0.9
}
